User ID,0,1,2,3,4,5,6,7,8,9
379,"Low Down Dirty Shame, A (1994)",Much Ado About Nothing (1993),Three Colors: Red (Trois couleurs: Rouge) (1994),Romper Stomper (1992),Mighty Aphrodite (1995),"American President, The (1995)",Copycat (1995),"Rock, The (1996)",Ink (2009),"Craft, The (1996)"
380,Malibu's Most Wanted (2003),"Russians Are Coming, the Russians Are Coming, The (1966)",Starman (1984),Grumpy Old Men (1993),Atlantic City (1980),"Public Enemy, The (1931)",Anna Christie (1930),"Cannonball Run, The (1981)",101 Reykjavik (101 Reykjavík) (2000),Dragon: The Bruce Lee Story (1993)
381,"Age of Innocence, The (1993)",Bloodsport 2 (a.k.a. Bloodsport II: The Next Kumite) (1996),Never Back Down (2008),Letters from Iwo Jima (2006),Grumpier Old Men (1995),"Cannonball Run, The (1981)","20,000 Leagues Under the Sea (1916)",City by the Sea (2002),"Rock, The (1996)",Vacation (2015)
382,Blood: The Last Vampire (2000),Raising Cain (1992),Sliding Doors (1998),Kurt & Courtney (1998),"Player, The (1992)","Batman/Superman Movie, The (1998)",Looking for Richard (1996),Five Deadly Venoms (1978),"Last Castle, The (2001)",Men in Black (a.k.a. MIB) (1997)
383,Casino Royale (1967),"Cry in the Dark, A (1988)","Ten, The (2007)",Cube (1997),"Ruins, The (2008)",Death on the Nile (1978),Pay It Forward (2000),Beautiful Girls (1996),Three Men and a Cradle (3 hommes et un couffin) (1985),"Time Masters (Maîtres du temps, Les) (1982)"
384,Peter Pan (1953),Awakenings (1990),Sgt. Bilko (1996),Mr. Magoo (1997),L.A. Confidential (1997),Tremors 4: The Legend Begins (2004),"Ballad of Narayama, The (Narayama bushiko) (1983)",To Die For (1995),Cowboy Bebop: The Movie (Cowboy Bebop: Tengoku no Tobira) (2001),Tombstone (1993)
385,Jefferson in Paris (1995),White Man's Burden (1995),"Greatest Story Ever Told, The (1965)","Piano, The (1993)","Cry, the Beloved Country (1995)",Castle Freak (1995),Mildred Pierce (1945),Midnight Cowboy (1969),Garage Days (2002),Starman (1984)
386,Outbreak (1995),Judge Dredd (1995),Tales from the Hood (1995),Mighty Aphrodite (1995),"Gods Must Be Crazy, The (1980)",Sabrina (1995),Run Silent Run Deep (1958),Mighty Morphin Power Rangers: The Movie (1995),"Paper, The (1994)",Jumanji (1995)
387,Hostage (2005),Blood Work (2002),Sarah Silverman: Jesus Is Magic (2005),One Flew Over the Cuckoo's Nest (1975),Smokey and the Bandit (1977),From Hell (2001),The Town that Dreaded Sundown (2014),Before and After (1996),13 Tzameti (2005),Onegin (1999)
388,Slow West (2015),"Masque of the Red Death, The (1964)",Analyze This (1999),Vibes (1988),Dragon Ball Z Gaiden: The Plot to Destroy the Saiyans (1993),"Adventures of Priscilla, Queen of the Desert, The (1994)",Grumpier Old Men (1995),RocketMan (a.k.a. Rocket Man) (1997),Spy Kids 3-D: Game Over (2003),Meet John Doe (1941)
389,Lone Star (1996),Zero Effect (1998),Batman Returns (1992),Jade (1995),Looking for Richard (1996),Teenage Mutant Ninja Turtles II: The Secret of the Ooze (1991),Something to Talk About (1995),Sabrina (1995),Beat the Devil (1953),Jerry Maguire (1996)
390,"Mummy, The (1932)",Duplicity (2009),3 dev adam (Three Giant Men) (1973) ,Swept Away (2002),Hamlet (2000),13 Tzameti (2005),"Crazies, The (a.k.a. Code Name: Trixie) (1973)",Enter the Dragon (1973),One Tough Cop (1998),Blame It on the Bellboy (1992)
391,You Can't Take It with You (1938),"Friend Is a Treasure, A (Chi Trova Un Amico, Trova un Tesoro) (Who Finds a Friend Finds a Treasure) (1981)","Million Dollar Hotel, The (2001)",Alaska: Spirit of the Wild (1997),Me and You and Everyone We Know (2005),In the Line of Fire (1993),Romeo Must Die (2000),Mystery Men (1999),White Men Can't Jump (1992),Amores Perros (Love's a Bitch) (2000)
392,"Kid, The (2000)",Beloved (1998),Less Than Zero (1987),Drowning Mona (2000),Body Heat (1981),T-Rex: Back to the Cretaceous (1998),"Brother from Another Planet, The (1984)",Firestarter (1984),"Child, The (L'enfant) (2005)",Stalag 17 (1953)
393,Lifeboat (1944),Deathtrap (1982),Beautiful (2000),Bound (1996),"Tracey Fragments, The (2007)",Cool Runnings (1993),"Man from Elysian Fields, The (2001)",Closer (2004),Star Wars: Episode IV - A New Hope (1977),Big Deal on Madonna Street (I Soliti Ignoti) (1958)
394,Much Ado About Nothing (1993),French Twist (Gazon maudit) (1995),"Low Down Dirty Shame, A (1994)",Blue Chips (1994),Mighty Aphrodite (1995),"Fast, Cheap & Out of Control (1997)",Outbreak (1995),Higher Learning (1995),"Great White Hype, The (1996)",Something to Talk About (1995)
395,Burnt by the Sun (Utomlyonnye solntsem) (1994),Orgazmo (1997),Naked Gun 33 1/3: The Final Insult (1994),Batman Forever (1995),"Black Dahlia, The (2006)","Mask, The (1994)",Foreign Correspondent (1940),Chopping Mall (a.k.a. Killbots) (1986),"Amityville Horror, The (2005)",Serpico (1973)
396,"Sword in the Stone, The (1963)",Letters from Iwo Jima (2006),"War of the Worlds, The (1953)",Quiz Show (1994),8 Heads in a Duffel Bag (1997),"Greatest Story Ever Told, The (1965)","Aristocats, The (1970)",Soul Food (1997),Edward Scissorhands (1990),Boogie Nights (1997)
397,Little Big Man (1970),Selena (1997),Babe (1995),"I Love You, I Love You Not (1996)","Elephant Man, The (1980)","South Park: Bigger, Longer and Uncut (1999)",Witness (1985),Quiz Show (1994),Chain Reaction (1996),It Takes Two (1995)
398,Body Parts (1991),Titanic (1997),Dream for an Insomniac (1996),Underneath (1995),Tarzan and the Lost City (1998),My Life (1993),Spy Game (2001),Selena (1997),Road to Morocco (1942),Maximum Overdrive (1986)
399,Body Heat (1981),Bound (1996),Quiz Show (1994),Chain Reaction (1996),"Pompatus of Love, The (1996)",Babe (1995),"Fighting Seabees, The (1944)",Six Degrees of Separation (1993),"Painted Veil, The (2006)",All Dogs Go to Heaven (1989)
400,Quiz Show (1994),Mighty Aphrodite (1995),Babe (1995),"Good, the Bad and the Ugly, The (Buono, il brutto, il cattivo, Il) (1966)","Gold Rush, The (1925)",13 Tzameti (2005),Heavy (1995),Flirting (1991),City by the Sea (2002),Boogie Nights (1997)
401,Babe (1995),"Secret of NIMH, The (1982)",Titanic (1997),"Aristocats, The (1970)",All Dogs Go to Heaven (1989),Jumanji (1995),Quiz Show (1994),Underworld (1996),Mighty Aphrodite (1995),Edward Scissorhands (1990)
402,Friday (1995),"Low Down Dirty Shame, A (1994)",Much Ado About Nothing (1993),Tarzan and the Lost City (1998),Sabrina (1995),"Hunted, The (1995)","Great White Hype, The (1996)",Teenage Mutant Ninja Turtles II: The Secret of the Ooze (1991),Silent Movie (1976),Jupiter's Wife (1994)
403,Avalon (1990),Phantasm IV: Oblivion (1998),"Legend of Sleepy Hollow, The (1980)",Look Who's Talking (1989),Kiss of Death (1995),American Ninja (1985),Quiz Show (1994),Bloodsport 2 (a.k.a. Bloodsport II: The Next Kumite) (1996),Bound (1996),Showgirls (1995)
404,Night of the Comet (1984),Lost in America (1985),Cape Fear (1991),Kids in the Hall: Brain Candy (1996),"Opposite of Sex, The (1998)",Mighty Morphin Power Rangers: The Movie (1995),"Fury, The (1978)",Dances with Wolves (1990),"Little Rascals, The (1994)",I'll Do Anything (1994)
405,Papillon (1973),Full Metal Jacket (1987),Mumford (1999),Body Parts (1991),"Cannonball Run, The (1981)",Stripes (1981),Boogie Nights (1997),Krippendorf's Tribe (1998),All Dogs Go to Heaven (1989),In the Company of Men (1997)
406,"Sword in the Stone, The (1963)",Dinosaur (2000),"Shawshank Redemption, The (1994)",Crumb (1994),"Secret of NIMH, The (1982)",Beautiful Thing (1996),From Dusk Till Dawn (1996),Snake Eyes (1998),"Rock, The (1996)",Something to Talk About (1995)
407,Something to Talk About (1995),Underneath (1995),Mighty Aphrodite (1995),Dream for an Insomniac (1996),"Human Condition II, The (Ningen no joken II) (1959)",All Dogs Go to Heaven (1989),Three Colors: Red (Trois couleurs: Rouge) (1994),Career Girls (1997),Quiz Show (1994),Romper Stomper (1992)
408,Quiz Show (1994),Letters from Iwo Jima (2006),Mighty Aphrodite (1995),"War of the Worlds, The (1953)","Low Down Dirty Shame, A (1994)",Road to Morocco (1942),Something to Talk About (1995),Toy Story 2 (1999),Teenage Mutant Ninja Turtles II: The Secret of the Ooze (1991),Safe (1995)
409,Sliding Doors (1998),Wag the Dog (1997),Bait (2000),New Police Story (Xin jing cha gu shi) (2004),Five Deadly Venoms (1978),Yellow Submarine (1968),Domino (2005),"Fighting Seabees, The (1944)","Rocky Horror Picture Show, The (1975)",Free Enterprise (1998)
410,Booty Call (1997),"Saint, The (1997)","Painted Veil, The (2006)",Full Metal Jacket (1987),Female Trouble (1975),Duplicity (2009),Psycho III (1986),Event Horizon (1997),Where the Buffalo Roam (1980),Scream 2 (1997)
411,Nowhere in Africa (Nirgendwo in Afrika) (2001),"Odd Couple, The (1968)",Narc (2002),Conan the Barbarian (1982),Garage Days (2002),Eight Below (2006),Tom and Huck (1995),Kull the Conqueror (1997),"Shawshank Redemption, The (1994)","NeverEnding Story, The (1984)"
412,"Pink Panther 2, The (2009)",Amazing Grace and Chuck (1987),Last Knights (2015),Less Than Zero (1987),Peter Pan (1953),In the Mouth of Madness (1995),Hope and Glory (1987),Breathless (À bout de souffle) (1960),Orlando (1992),Wrong Turn 2: Dead End (2007)
413,Blues Brothers 2000 (1998),Dinosaur (2000),Autumn in New York (2000),Sliding Doors (1998),Edward Scissorhands (1990),"Legend of Sleepy Hollow, The (1980)",Kiss of Death (1995),Stop! Or My Mom Will Shoot (1992),"Age of Innocence, The (1993)",Babes in Toyland (1934)
414,Teeth (2007),"Mothman Prophecies, The (2002)","Night Listener, The (2006)","Prince & Me, The (2004)","Secret Life of Walter Mitty, The (1947)",Red Dragon (2002),Nancy Drew (2007),"Thrill of It All, The (1963)",You'll Never Get Rich (1941),Libeled Lady (1936)
415,"Legend of Sleepy Hollow, The (1980)",Amistad (1997),City by the Sea (2002),Quiz Show (1994),"Bad Seed, The (1956)","Quest for Fire (Guerre du feu, La) (1981)",Pride and Glory (2008),Untamed Heart (1993),Carnival Magic (1981),Airborne (1993)
416,Amores Perros (Love's a Bitch) (2000),"Mothman Prophecies, The (2002)",Never Let Me Go (2010),Mighty Aphrodite (1995),Chitty Chitty Bang Bang (1968),Sabrina (1995),School Ties (1992),Captains Courageous (1937),"Innocent Man, An (1989)",Kiss of Death (1995)
417,"War of the Worlds, The (1953)",Three Colors: Red (Trois couleurs: Rouge) (1994),"I Love You, I Love You Not (1996)",Mighty Aphrodite (1995),Heavy (1995),Babe (1995),Untamed Heart (1993),Jumanji (1995),Artemisia (1997),Lethal Weapon 2 (1989)
418,Something to Talk About (1995),All Dogs Go to Heaven (1989),In the Company of Men (1997),"Fast, Cheap & Out of Control (1997)",Jumanji (1995),"Lock, Stock & Two Smoking Barrels (1998)",Punchline (1988),Mighty Aphrodite (1995),"Elephant Man, The (1980)",Road to Morocco (1942)
419,'Hellboy': The Seeds of Creation (2004),Indian Summer (a.k.a. Alive & Kicking) (1996),Kiss of Death (1995),"Big Lebowski, The (1998)","Wild Bunch, The (1969)","South Park: Bigger, Longer and Uncut (1999)","School of Flesh, The (École de la chair, L') (1998)",Bloodsport 2 (a.k.a. Bloodsport II: The Next Kumite) (1996),"Age of Innocence, The (1993)",Papillon (1973)
420,"Bridges of Madison County, The (1995)",Nancy Drew (2007),Starman (1984),Psycho III (1986),Cheech & Chong's The Corsican Brothers (1984),Murphy's Romance (1985),Ink (2009),Toy Story 2 (1999),Mystic Pizza (1988),Billy Elliot (2000)
421,Drop Zone (1994),Tora! Tora! Tora! (1970),3 dev adam (Three Giant Men) (1973) ,"Saint, The (1997)",Indian Summer (a.k.a. Alive & Kicking) (1996),Selena (1997),Eve's Bayou (1997),Total Eclipse (1995),"Twelve Chairs, The (1970)",It Takes Two (1995)
422,"Silence, The (Tystnaden) (1963)",Star Trek: Nemesis (2002),To Have and Have Not (1944),Frankenstein Meets the Wolf Man (1943),Breakin' All the Rules (2004),Cabin Boy (1994),"Deep End of the Ocean, The (1999)",Teeth (2007),Ugetsu (Ugetsu monogatari) (1953),And Then There Were None (1945)
423,Mighty Aphrodite (1995),"Pompatus of Love, The (1996)",Amistad (1997),Jupiter's Wife (1994),Mother (1996),Barb Wire (1996),Something to Talk About (1995),Surrogates (2009),Wolf (1994),"Low Down Dirty Shame, A (1994)"
424,"Bourne Ultimatum, The (2007)",Kiss of Death (1995),Artemisia (1997),Lone Star (1996),"Grey Zone, The (2001)",Kiss Kiss Bang Bang (2005),"His Secret Life (a.k.a. Ignorant Fairies, The) (Fate ignoranti, Le) (2001)","Shawshank Redemption, The (1994)",Major Dundee (1965),"Bounty, The (1984)"
425,Lake Placid (1999),Chaos (2005),Undisputed III: Redemption (2010),Pride and Glory (2008),"New York, I Love You (2009)",Year of the Horse (1997),Bedtime Stories (2008),Proof of Life (2000),Body Snatchers (1993),"Prince & Me, The (2004)"
426,Be Cool (2005),Mighty Morphin Power Rangers: The Movie (1995),Real Women Have Curves (2002),Surrogates (2009),Villain (1971),"20,000 Leagues Under the Sea (1916)","Lock, Stock & Two Smoking Barrels (1998)",Spy Game (2001),"Painted Veil, The (2006)",The Monkey King (1964)
427,"Family Stone, The (2005)",K-9 (1989),Particle Fever (2013),"Clonus Horror, The (1979)",Insidious (2010),Glitter (2001),"Synecdoche, New York (2008)",MirrorMask (2005),Employee of the Month (2004),McCabe & Mrs. Miller (1971)
428,Gremlins 2: The New Batch (1990),"Cannonball Run, The (1981)",Gigi (1958),McCabe & Mrs. Miller (1971),Grumpy Old Men (1993),8 Heads in a Duffel Bag (1997),One True Thing (1998),Selena (1997),Edward Scissorhands (1990),"Lake House, The (2006)"
429,Tattooed Life (Irezumi ichidai) (1965),Denise Calls Up (1995),Hipsters (Stilyagi) (2008),Faster Pussycat! Kill! Kill! (1965),Death and the Maiden (1994),"Madness of King George, The (1994)",Reservoir Dogs (1992),S.F.W. (1994),Interview with the Vampire: The Vampire Chronicles (1994),Rosemary's Baby (1968)
430,Star Maps (1997),Krippendorf's Tribe (1998),All Dogs Go to Heaven (1989),"Stepford Wives, The (1975)","Glass House, The (2001)",Animal Crackers (1930),"Punisher, The (1989)",New Police Story (Xin jing cha gu shi) (2004),Toy Story 2 (1999),Mighty Aphrodite (1995)
431,Mildred Pierce (1945),Bill & Ted's Excellent Adventure (1989),"Adventures of Priscilla, Queen of the Desert, The (1994)",Under Siege 2: Dark Territory (1995),All Dogs Go to Heaven (1989),"Mrs. Brown (a.k.a. Her Majesty, Mrs. Brown) (1997)",Letters from Iwo Jima (2006),Gloomy Sunday (Ein Lied von Liebe und Tod) (1999),Ghosts of Mars (2001),Batman Returns (1992)
432,Heavenly Creatures (1994),Outrageous Fortune (1987),Umberto D. (1952),Above the Rim (1994),"Fast, Cheap & Out of Control (1997)",Land Before Time III: The Time of the Great Giving (1995),"To Wong Foo, Thanks for Everything! Julie Newmar (1995)",When Night Is Falling (1995),Firestarter (1984),Moonraker (1979)
433,Mighty Aphrodite (1995),"Age of Innocence, The (1993)",Toy Story 2 (1999),Cool Runnings (1993),Mighty Morphin Power Rangers: The Movie (1995),Never Back Down (2008),Mary Shelley's Frankenstein (Frankenstein) (1994),"I Love You, I Love You Not (1996)",Heavy (1995),Selena (1997)
434,Babe (1995),Quiz Show (1994),Never Let Me Go (2010),"Fast, Cheap & Out of Control (1997)",Mighty Aphrodite (1995),"Original Kings of Comedy, The (2000)","South Park: Bigger, Longer and Uncut (1999)",Letters from Iwo Jima (2006),Titanic (1997),Jerry Maguire (1996)
435,Fearless (1993),Lilies of the Field (1963),Reality (2014),Dinosaur (2000),Malibu's Most Wanted (2003),Surrogates (2009),"Fast, Cheap & Out of Control (1997)",Kiss of Death (1995),Clean Slate (1994),Never Let Me Go (2010)
436,Don Juan DeMarco (1995),Blown Away (1994),Ghost in the Shell (Kôkaku kidôtai) (1995),Never Let Me Go (2010),Dragon Ball Z Gaiden: The Plot to Destroy the Saiyans (1993),From Hell (2001),Kiss of Death (1995),Jumanji (1995),The Magician (1958),Much Ado About Nothing (1993)
437,Before We Go (2014),Seventh Son (2014),Dark Days (2000),Edward Scissorhands (1990),Penny Serenade (1941),Mary Shelley's Frankenstein (Frankenstein) (1994),Krippendorf's Tribe (1998),"Fabulous Baker Boys, The (1989)",Bullets Over Broadway (1994),Bio-Dome (1996)
438,Maze Runner: Scorch Trials (2015),Fellini's Casanova (Il Casanova di Federico Fellini) (1976),Things You Can Tell Just by Looking at Her (2000),Dead Again (1991),House of 1000 Corpses (2003),Fast Times at Ridgemont High (1982),"Mexican, The (2001)","Calcium Kid, The (2004)",Bad Boy Bubby (1993),"Doors, The (1991)"
439,Teenage Mutant Ninja Turtles II: The Secret of the Ooze (1991),Bound (1996),Sabrina (1995),"Fast, Cheap & Out of Control (1997)",Something to Talk About (1995),"South Park: Bigger, Longer and Uncut (1999)",In the Company of Men (1997),Picture Perfect (1997),Mighty Aphrodite (1995),Romper Stomper (1992)
440,South Park: Imaginationland (2008),Fantastic Four (2015),200 Cigarettes (1999),Harold and Kumar Go to White Castle (2004),Destiny Turns on the Radio (1995),Barton Fink (1991),"Brain Smasher... A Love Story (Bouncer and the Lady, The) (1993)",Meatballs III (1987),Ruby Red (2013),Fluke (1995)
441,Washington Square (1997),Full Metal Jacket (1987),Mighty Aphrodite (1995),Quiz Show (1994),'night Mother (1986),"Third Man, The (1949)",Something to Talk About (1995),All Dogs Go to Heaven (1989),American Beauty (1999),"Mrs. Brown (a.k.a. Her Majesty, Mrs. Brown) (1997)"
442,"Odd Couple, The (1968)",Star Wars: Episode I - The Phantom Menace (1999),Jungle2Jungle (a.k.a. Jungle 2 Jungle) (1997),"Fall of the House of Usher, The (House of Usher) (1960)",Quiz Show (1994),Undercover Blues (1993),Avalon (1990),Snake Eyes (1998),Burnt Offerings (1976),Quatermass and the Pit (1967)
443,Captains Courageous (1937),Kiss of Death (1995),Mighty Aphrodite (1995),"Blood of the Beasts (Sang des bêtes, Le) (1949)",Something to Talk About (1995),Road to Morocco (1942),Mighty Morphin Power Rangers: The Movie (1995),TiMER (2009),Copycat (1995),Babes in Toyland (1934)
444,Mary Shelley's Frankenstein (Frankenstein) (1994),"Greatest Story Ever Told, The (1965)",Teenage Mutant Ninja Turtles II: The Secret of the Ooze (1991),Barb Wire (1996),Pie in the Sky (1996),Mighty Aphrodite (1995),"Aristocats, The (1970)",Tales from the Hood (1995),Much Ado About Nothing (1993),"Age of Innocence, The (1993)"
445,Female Trouble (1975),Mighty Aphrodite (1995),Penny Serenade (1941),"Age of Innocence, The (1993)","Mrs. Brown (a.k.a. Her Majesty, Mrs. Brown) (1997)","Fury, The (1978)","War of the Worlds, The (1953)","Blood of the Beasts (Sang des bêtes, Le) (1949)",Heavy (1995),Free Enterprise (1998)
446,"Secret of NIMH, The (1982)","Little Rascals, The (1994)",Chain Reaction (1996),Babe (1995),"Aristocats, The (1970)",Jumanji (1995),Romper Stomper (1992),Mighty Aphrodite (1995),Edward Scissorhands (1990),True Lies (1994)
447,Swingers (1996),Much Ado About Nothing (1993),Wild Things (1998),French Twist (Gazon maudit) (1995),"Low Down Dirty Shame, A (1994)",Wet Hot American Summer (2001),Romper Stomper (1992),Mumford (1999),Barb Wire (1996),"Secret of NIMH, The (1982)"
448,G-Force (2009),Open Hearts (Elsker dig for evigt) (2002),Run Silent Run Deep (1958),"Mrs. Brown (a.k.a. Her Majesty, Mrs. Brown) (1997)",Artemisia (1997),Captains Courageous (1937),Rosetta (1999),Dragon Ball Z Gaiden: The Plot to Destroy the Saiyans (1993),Something to Talk About (1995),Jerry Maguire (1996)
449,"Mrs. Brown (a.k.a. Her Majesty, Mrs. Brown) (1997)","Age of Innocence, The (1993)",From Dusk Till Dawn (1996),Mary Shelley's Frankenstein (Frankenstein) (1994),Babe (1995),"Fast, Cheap & Out of Control (1997)",Waiting to Exhale (1995),"Broken Hearts Club, The (2000)",Airheads (1994),Jupiter's Wife (1994)
450,Bound (1996),Oklahoma! (1955),Dances with Wolves (1990),"Rocky Horror Picture Show, The (1975)",Road to Morocco (1942),Sabrina (1995),"Secret of NIMH, The (1982)",Something to Talk About (1995),Three Colors: Red (Trois couleurs: Rouge) (1994),City by the Sea (2002)
451,Blown Away (1994),Jumanji (1995),"Low Down Dirty Shame, A (1994)",Bound (1996),Psycho (1960),Sabrina (1995),From Dusk Till Dawn (1996),Quiz Show (1994),"Aristocats, The (1970)",In the Company of Men (1997)
452,3 dev adam (Three Giant Men) (1973) ,"Wind That Shakes the Barley, The (2006)",Swingers (1996),District 9 (2009),New Police Story (Xin jing cha gu shi) (2004),Bloodsport 2 (a.k.a. Bloodsport II: The Next Kumite) (1996),"Mexican, The (2001)",Men at Work (1990),Star Maps (1997),"Punisher, The (1989)"
453,Pride and Prejudice (1940),Best of the Best (1989),Babe (1995),"Steal Big, Steal Little (1995)",Nevada Smith (1966),Letters from Iwo Jima (2006),Never Let Me Go (2010),Real Women Have Curves (2002),Heavy (1995),"Aristocats, The (1970)"
454,Quiz Show (1994),Letters from Iwo Jima (2006),Chopping Mall (a.k.a. Killbots) (1986),Cemetery Man (Dellamorte Dellamore) (1994),Bobby (2006),Battle in Seattle (2007),"Black Stallion Returns, The (1983)",In the Company of Men (1997),Ladybird Ladybird (1994),Autumn in New York (2000)
455,"X-Files: Fight the Future, The (1998)",Jumanji (1995),Color of Night (1994),Five Easy Pieces (1970),"Low Down Dirty Shame, A (1994)",Much Ado About Nothing (1993),Ladybird Ladybird (1994),Beverly Hills Cop III (1994),Mighty Morphin Power Rangers: The Movie (1995),"Aristocats, The (1970)"
456,Lone Star (1996),Swingers (1996),Titanic (1997),Babe (1995),Three Colors: Red (Trois couleurs: Rouge) (1994),Something to Talk About (1995),GoldenEye (1995),Get on the Bus (1996),Bloodsport 2 (a.k.a. Bloodsport II: The Next Kumite) (1996),Romper Stomper (1992)
457,"Stunt Man, The (1980)",Dirty Dancing: Havana Nights (2004),Radioland Murders (1994),To Kill a Mockingbird (1962),Jesus' Son (1999),Bloodsport 2 (a.k.a. Bloodsport II: The Next Kumite) (1996),Love Potion #9 (1992),Quiz Show (1994),"Greatest Story Ever Told, The (1965)",Quest for Camelot (1998)
458,Hype! (1996),"Kid in King Arthur's Court, A (1995)","Harvey Girls, The (1946)",Ghost in the Shell (Kôkaku kidôtai) (1995),Three Colors: Red (Trois couleurs: Rouge) (1994),xXx: State of the Union (2005),Get on the Bus (1996),Under Siege 2: Dark Territory (1995),Grumpier Old Men (1995),Love & Human Remains (1993)
459,Letters from Iwo Jima (2006),Toy Story 2 (1999),Autumn in New York (2000),"Age of Innocence, The (1993)",Buena Vista Social Club (1999),Cemetery Man (Dellamorte Dellamore) (1994),Mighty Aphrodite (1995),Mighty Morphin Power Rangers: The Movie (1995),Jupiter's Wife (1994),Titanic (1997)
460,Prizzi's Honor (1985),Dobermann (1997),Run Fatboy Run (2007),"Me, Myself & Irene (2000)",Lone Star (1996),National Security (2003),Triumph of the Will (Triumph des Willens) (1934),"Last Castle, The (2001)",Police Academy 5: Assignment: Miami Beach (1988),"Child, The (L'enfant) (2005)"
461,Teenage Mutant Ninja Turtles II: The Secret of the Ooze (1991),"Fast, Cheap & Out of Control (1997)",It Takes Two (1995),Sabrina (1995),Mighty Aphrodite (1995),Kiss of Death (1995),"X-Files: Fight the Future, The (1998)",Jumanji (1995),"South Park: Bigger, Longer and Uncut (1999)","Age of Innocence, The (1993)"
462,"Host, The (2013)","Bounty, The (1984)","Wings of Desire (Himmel über Berlin, Der) (1987)",Female Trouble (1975),Air Bud: Golden Receiver (1998),Body Heat (1981),"Legend of Sleepy Hollow, The (1980)",Tarzan and the Lost City (1998),"Stepford Wives, The (1975)",Chocolat (1988)
463,Never Let Me Go (2010),Selena (1997),"Painted Veil, The (2006)","Whole Wide World, The (1996)",Female Trouble (1975),Battlefield Earth (2000),"Thomas Crown Affair, The (1968)",Cemetery Man (Dellamorte Dellamore) (1994),Kiss of Death (1995),"Age of Innocence, The (1993)"
464,Bound (1996),Three Colors: Red (Trois couleurs: Rouge) (1994),Fargo (1996),Star Maps (1997),Robin Hood: Prince of Thieves (1991),"Man from Elysian Fields, The (2001)","Aristocats, The (1970)",Quiz Show (1994),Edward Scissorhands (1990),Underneath (1995)
465,Earth Girls Are Easy (1988),Otello (1986),52 Pick-Up (1986),Duck Soup (1933),When the Cat's Away (Chacun cherche son chat) (1996),Manon of the Spring (Manon des sources) (1986),American Pie 2 (2001),"Pink Panther, The (1963)",Short Cuts (1993),Village of the Damned (1995)
466,Picture Perfect (1997),Something to Talk About (1995),Mighty Aphrodite (1995),Quiz Show (1994),Safe (1995),"Red Balloon, The (Ballon rouge, Le) (1956)","South Park: Bigger, Longer and Uncut (1999)",Villain (1971),Heavy (1995),Titanic (1997)
467,Fearless (1993),Lost in Translation (2003),Room at the Top (1959),"Tinker, Tailor, Soldier, Spy (1979)",One False Move (1992),To Die For (1995),Friday the 13th Part 3: 3D (1982),"Discreet Charm of the Bourgeoisie, The (Charme discret de la bourgeoisie, Le) (1972)",Robin and Marian (1976),Fire in the Sky (1993)
468,Quiz Show (1994),"Fast, Cheap & Out of Control (1997)","I Love You, I Love You Not (1996)",Chain Reaction (1996),Picture Perfect (1997),Mighty Aphrodite (1995),Toy Story 2 (1999),"South Park: Bigger, Longer and Uncut (1999)",Jupiter's Wife (1994),Underworld (1996)
469,"Fiendish Plot of Dr. Fu Manchu, The (1980)",Amazing Grace and Chuck (1987),"Duck, You Sucker (1971)",King of Hearts (1966),Children of the Corn II: The Final Sacrifice (1993),"Fabulous Baker Boys, The (1989)","Devil and Max Devlin, The (1981)",Autumn in New York (2000),Monkey Trouble (1994),Problem Child 2 (1991)
470,Something to Talk About (1995),Babe (1995),Teenage Mutant Ninja Turtles II: The Secret of the Ooze (1991),Mighty Aphrodite (1995),Three Colors: Red (Trois couleurs: Rouge) (1994),"Cry, the Beloved Country (1995)",Heavy (1995),I'll Do Anything (1994),"War of the Worlds, The (1953)",Jumanji (1995)
471,Never Let Me Go (2010),Mighty Aphrodite (1995),"Fast, Cheap & Out of Control (1997)",Star Maps (1997),Heavy (1995),City by the Sea (2002),Spy Game (2001),Career Girls (1997),Staying Alive (1983),Edward Scissorhands (1990)
472,Star Maps (1997),Selena (1997),"Man from Elysian Fields, The (2001)",New Police Story (Xin jing cha gu shi) (2004),Turtle Diary (1985),Toy Story 2 (1999),"Great Mouse Detective, The (1986)",Mighty Aphrodite (1995),13 Tzameti (2005),Yellow Submarine (1968)
