User ID,0,1,2,3,4,5,6,7,8,9
189,Mighty Aphrodite (1995),"Aristocats, The (1970)",Babe (1995),Quiz Show (1994),Something to Talk About (1995),Jumanji (1995),Teenage Mutant Ninja Turtles II: The Secret of the Ooze (1991),"Lock, Stock & Two Smoking Barrels (1998)",Letters from Iwo Jima (2006),Mary Shelley's Frankenstein (Frankenstein) (1994)
190,Beyond the Clouds (Al di là delle nuvole) (1996),Horror of Dracula (Dracula) (1958),School Ties (1992),Certified Copy (Copie conforme) (2010),Hope Springs (2003),Tarzan and the Lost City (1998),"Lock, Stock & Two Smoking Barrels (1998)",Inside Man (2006),Villain (1971),Mrs. Doubtfire (1993)
191,National Lampoon's Senior Trip (1995),"Hunted, The (1995)",Bound (1996),"Prophecy, The (1995)",Before Sunrise (1995),Star Wars: Episode IV - A New Hope (1977),From Dusk Till Dawn (1996),Pie in the Sky (1996),Tank Girl (1995),Wallace & Gromit: The Best of Aardman Animation (1996)
192,Dances with Wolves (1990),Titanic (1997),"Aristocats, The (1970)",Cemetery Man (Dellamorte Dellamore) (1994),Mighty Aphrodite (1995),It Takes Two (1995),"Elephant Man, The (1980)",Picture Perfect (1997),Tales from the Hood (1995),"Sixth Sense, The (1999)"
193,Autumn in New York (2000),"Mrs. Brown (a.k.a. Her Majesty, Mrs. Brown) (1997)",Cool Runnings (1993),"Fast, Cheap & Out of Control (1997)",Something to Talk About (1995),Toy Story 2 (1999),Krippendorf's Tribe (1998),Selena (1997),Picture Perfect (1997),Virtuosity (1995)
194,Beowulf & Grendel (2005),Smoke Signals (1998),"Private Eyes, The (1981)",Spaced Invaders (1990),Wild Things (1998),Godsend (2004),Rain Man (1988),Best in Show (2000),Wolf (1994),Boys Life (1995)
195,"Mexican, The (2001)",Out of Sight (1998),"Bride of Frankenstein, The (Bride of Frankenstein) (1935)","Big Red One, The (1980)","NeverEnding Story, The (1984)",Quiz Show (1994),"Captain Newman, M.D. (1963)",Zero Effect (1998),New Police Story (Xin jing cha gu shi) (2004),Captains Courageous (1937)
196,Domino (2005),Psycho III (1986),Amistad (1997),One True Thing (1998),"Bad Seed, The (1956)",Plan 9 from Outer Space (1959),"Pompatus of Love, The (1996)",Dream for an Insomniac (1996),My Demon Lover (1987),Mighty Aphrodite (1995)
197,Grumpy Old Men (1993),D2: The Mighty Ducks (1994),Papillon (1973),Almost Heroes (1998),Mumford (1999),Mighty Aphrodite (1995),Female Trouble (1975),Dumbo (1941),In the Company of Men (1997),"South Park: Bigger, Longer and Uncut (1999)"
198,"End of the Affair, The (1999)",Billy Elliot (2000),Cemetery Man (Dellamorte Dellamore) (1994),City by the Sea (2002),Quiz Show (1994),Soul Food (1997),Titanic (1997),Babe (1995),Tomorrow Never Dies (1997),Airheads (1994)
199,Adaptation (2002),Bad Karma (2012),Broadcast News (1987),Horse Feathers (1932),Digimon: The Movie (2000),"Third Man, The (1949)","Hard Day's Night, A (1964)",Percy Jackson & the Olympians: The Lightning Thief (2010),Event Horizon (1997),Missing in Action 2: The Beginning (1985)
200,Coffy (1973),Vibes (1988),Five Easy Pieces (1970),Looking for Richard (1996),Maximum Overdrive (1986),"Gods Must Be Crazy, The (1980)",Something to Talk About (1995),"Secret of NIMH, The (1982)",Ghosts of Mars (2001),"NeverEnding Story, The (1984)"
201,Mighty Aphrodite (1995),Something to Talk About (1995),Dream for an Insomniac (1996),Witness (1985),Quiz Show (1994),Free Enterprise (1998),Jupiter's Wife (1994),Restoration (1995),It Takes Two (1995),Under Siege 2: Dark Territory (1995)
202,"Phantom, The (1996)","Omen, The (2006)","Trials of Henry Kissinger, The (2002)",Picnic at Hanging Rock (1975),Hope Springs (2003),Even Cowgirls Get the Blues (1993),"Saint, The (1997)",Don Jon (2013),Swamp Thing (1982),Man's Best Friend (1993)
203,Captains Courageous (1937),Zero Effect (1998),"Mrs. Brown (a.k.a. Her Majesty, Mrs. Brown) (1997)",Romper Stomper (1992),Sabrina (1995),"Rock, The (1996)",Jumanji (1995),"Little Rascals, The (1994)",Lamerica (1994),"20,000 Leagues Under the Sea (1916)"
204,Mighty Aphrodite (1995),Robin Hood: Prince of Thieves (1991),Kiss of Death (1995),Letters from Iwo Jima (2006),Quiz Show (1994),Mighty Morphin Power Rangers: The Movie (1995),Cemetery Man (Dellamorte Dellamore) (1994),Full Metal Jacket (1987),"Aristocats, The (1970)",Krippendorf's Tribe (1998)
205,Mighty Aphrodite (1995),"Gods Must Be Crazy, The (1980)",Krippendorf's Tribe (1998),Hideous Kinky (1998),Something to Talk About (1995),"Elephant Man, The (1980)",Edward Scissorhands (1990),Road to Morocco (1942),"Nosferatu (Nosferatu, eine Symphonie des Grauens) (1922)",Quiz Show (1994)
206,Babe (1995),Body Heat (1981),Bio-Dome (1996),Bound (1996),Dark Days (2000),"Cry, the Beloved Country (1995)",From Dusk Till Dawn (1996),Chain Reaction (1996),Titanic (1997),Wag the Dog (1997)
207,Adaptation (2002),"Nine Lives of Tomas Katz, The (2000)","Calcium Kid, The (2004)","Postman, The (1997)",Wet Hot American Summer (2001),"NeverEnding Story, The (1984)","Son's Room, The (Stanza del figlio, La) (2001)",Superbad (2007),Yellow Submarine (1968),"Spy Who Loved Me, The (1977)"
208,Kiss me Kismet (2006),Intact (Intacto) (2001),From Hell (2001),Daria: Is It College Yet? (2002),Shooting Dogs (a.k.a. Beyond the Gates) (2005),Amores Perros (Love's a Bitch) (2000),"Boys, The (1998)","Sword in the Stone, The (1963)",Seabiscuit (2003),Ice Princess (2005)
209,Titanic (1997),Teenage Mutant Ninja Turtles II: The Secret of the Ooze (1991),Quiz Show (1994),"Fast, Cheap & Out of Control (1997)","South Park: Bigger, Longer and Uncut (1999)",Bloodsport 2 (a.k.a. Bloodsport II: The Next Kumite) (1996),"Blood of the Beasts (Sang des bêtes, Le) (1949)",Picture Perfect (1997),Jupiter's Wife (1994),Mighty Morphin Power Rangers: The Movie (1995)
210,"Art of Getting By, The (2011)",Dylan Moran: Monster (2004),Taken (2008),"Trip, The (2002)",Scary Movie 3 (2003),Vampire Hunter D (1985),White Chicks (2004),Love Potion #9 (1992),Less Than Zero (1987),"Cool, Dry Place, A (1998)"
211,Bill Hicks: Revelations (1993),Only You (1994),Body Parts (1991),Lilies of the Field (1963),Quest for Camelot (1998),Autumn in New York (2000),Carnival Magic (1981),Keeping the Faith (2000),"Fast, Cheap & Out of Control (1997)","Bounty, The (1984)"
212,Z (1969),Desperate Measures (1998),"Fast, Cheap & Out of Control (1997)","South Park: Bigger, Longer and Uncut (1999)",Crimson Gold (Talaye sorgh) (2003),Triumph of the Will (Triumph des Willens) (1934),Wolf (1994),Scream 2 (1997),Miracles - Mr. Canton and Lady Rose (1989),Clean Slate (1994)
213,What Love Is (2007),Hellsinki (Rööperi) (2009),Bustin' Loose (1981),"Happy, Texas (1999)",Mad City (1997),Animal House (1978),My Best Friend's Girl (2008),Pride & Prejudice (2005),"Duck, You Sucker (1971)",Seventh Son (2014)
214,Beautiful Girls (1996),Zero Effect (1998),Four Rooms (1995),Beat the Devil (1953),Jumanji (1995),Brubaker (1980),Dances with Wolves (1990),Jack (1996),"Adventures of Priscilla, Queen of the Desert, The (1994)",Free Willy 2: The Adventure Home (1995)
215,Full Metal Jacket (1987),When Night Is Falling (1995),Mighty Aphrodite (1995),Beyond Borders (2003),Psycho III (1986),Teenage Mutant Ninja Turtles II: The Secret of the Ooze (1991),Pickup on South Street (1953),Quiz Show (1994),Witness (1985),"Namesake, The (2006)"
216,Trouble in Paradise (1932),Artemisia (1997),Night of the Comet (1984),"Pompatus of Love, The (1996)",Beloved (1998),Crimson Gold (Talaye sorgh) (2003),Dracula Untold (2014),Robin Hood: Prince of Thieves (1991),Female Trouble (1975),In the Company of Men (1997)
217,From Dusk Till Dawn 2: Texas Blood Money (1999) ,Body Shots (1999),Around the World in 80 Days (2004),Blazing Saddles (1974),"Swarm, The (1978)",Respiro (2002),Cry-Baby (1990),"Castle, The (1997)",Wisdom (1986),Crimewave (1985)
218,My Man Godfrey (1957),Event Horizon (1997),Ghost in the Shell (Kôkaku kidôtai) (1995),Accepted (2006),It Takes Two (1995),Mighty Aphrodite (1995),Female Trouble (1975),Witness (1985),"Craft, The (1996)",Scream 2 (1997)
219,Quiz Show (1994),Dr. Dolittle (1998),"American President, The (1995)",Cool Runnings (1993),Dracula Untold (2014),Tales from the Darkside: The Movie (1990),Perfect Blue (1997),City by the Sea (2002),Bloodsport 2 (a.k.a. Bloodsport II: The Next Kumite) (1996),"Man with Two Brains, The (1983)"
220,"Saint, The (1997)",My Life (1993),"Fabulous Baker Boys, The (1989)",Selena (1997),Miracles - Mr. Canton and Lady Rose (1989),Event Horizon (1997),Cool Runnings (1993),Ghosts of Mars (2001),"Glass House, The (2001)",Punch-Drunk Love (2002)
221,Stop! Or My Mom Will Shoot (1992),"Doors, The (1991)",Full Metal Jacket (1987),Chitty Chitty Bang Bang (1968),"Cruise, The (1998)",Selena (1997),"Gods Must Be Crazy, The (1980)",In the Company of Men (1997),Kiss of Death (1995),Something to Talk About (1995)
222,Chapayev (1934),Color of Night (1994),Gloomy Sunday (Ein Lied von Liebe und Tod) (1999),Get on the Bus (1996),"Grand Day Out with Wallace and Gromit, A (1989)",Never Back Down (2008),Road to Morocco (1942),Red Army (2014),Shanghai Noon (2000),Artemisia (1997)
223,"Sandlot, The (1993)","Zed & Two Noughts, A (1985)",Alice (1990),Julia (2014),Quiz Show (1994),Banana Joe (1981),Jungle2Jungle (a.k.a. Jungle 2 Jungle) (1997),Open Hearts (Elsker dig for evigt) (2002),A Merry Friggin' Christmas (2014),"Man with Two Brains, The (1983)"
224,"American Astronaut, The (2001)",White Man's Burden (1995),"Major and the Minor, The (1942)","Last King of Scotland, The (2006)",Ran (1985),Return to Never Land (2002),Italian for Beginners (Italiensk for begyndere) (2000),"Batman/Superman Movie, The (1998)","Garden of the Finzi-Continis, The (Giardino dei Finzi-Contini, Il) (1970)",Cry-Baby (1990)
225,Night of the Comet (1984),"To Wong Foo, Thanks for Everything! Julie Newmar (1995)",Child's Play 3 (1991),Spartan (2004),"Blood of the Beasts (Sang des bêtes, Le) (1949)",Best of the Best (1989),Perfect Blue (1997),Little Nicky (2000),"American President, The (1995)","Craft, The (1996)"
226,Event Horizon (1997),McCabe & Mrs. Miller (1971),"Low Down Dirty Shame, A (1994)",Mighty Aphrodite (1995),French Twist (Gazon maudit) (1995),It Came from Outer Space (1953),"Big Easy, The (1987)",Grumpy Old Men (1993),"Pompatus of Love, The (1996)",Toy Story 2 (1999)
227,April Morning (1988),"Hunted, The (1995)",Bloody Sunday (2002),Despicable Me (2010),Exit Through the Gift Shop (2010),Hamlet (2000),Lamerica (1994),Hoodlum (1997),"Namesake, The (2006)","Elephant Man, The (1980)"
228,Song of the Little Road (Pather Panchali) (1955),"Matrix Reloaded, The (2003)",Air Bud: Golden Receiver (1998),My Life (1993),Gerry (2002),Child's Play (1988),"Star Is Born, A (1937)",Dinosaur (2000),Monkeybone (2001),Black Christmas (2006)
229,Heat (1995),Quiz Show (1994),Jumanji (1995),Mighty Aphrodite (1995),"Aristocats, The (1970)",Witness (1985),Blown Away (1994),"I Love You, I Love You Not (1996)",Lamerica (1994),Let's Get Harry (1986)
230,Bound (1996),"Legend of Sleepy Hollow, The (1980)","Haunted World of Edward D. Wood Jr., The (1996)",Never Let Me Go (2010),All Dogs Go to Heaven (1989),"Age of Innocence, The (1993)",Grumpier Old Men (1995),Babes in Toyland (1934),Clean Slate (1994),Vibes (1988)
231,Quiz Show (1994),"Fast, Cheap & Out of Control (1997)",Mighty Aphrodite (1995),13 Tzameti (2005),Romper Stomper (1992),Jupiter's Wife (1994),Letters from Iwo Jima (2006),Teenage Mutant Ninja Turtles II: The Secret of the Ooze (1991),Autumn in New York (2000),All Dogs Go to Heaven (1989)
232,Grown Ups (2010),"X-Files: Fight the Future, The (1998)",Five Easy Pieces (1970),Land Before Time III: The Time of the Great Giving (1995),"Greatest Story Ever Told, The (1965)",Tarzan and the Lost City (1998),Something to Talk About (1995),"Sixth Sense, The (1999)",Grumpier Old Men (1995),Beyond the Clouds (Al di là delle nuvole) (1996)
233,"6th Day, The (2000)",Cinderella (1997),Never Let Me Go (2010),Regret to Inform (1998),Hoodlum (1997),Lamerica (1994),"20,000 Leagues Under the Sea (1916)",Meatballs 4 (1992),Letters from Iwo Jima (2006),"Fast, Cheap & Out of Control (1997)"
234,Madagascar (2005),V. I. Warshawski (1991),Planet 51 (2009),"Blind Swordsman: Zatoichi, The (Zatôichi) (2003)",This Means War (2012),"Hitcher, The (1986)",Hoffa (1992),"To Wong Foo, Thanks for Everything! Julie Newmar (1995)",Greenfingers (2000),Armour of God II: Operation Condor (Operation Condor) (Fei ying gai wak) (1991)
235,In the Company of Men (1997),Jumanji (1995),"I Love You, I Love You Not (1996)",Toy Story 2 (1999),All Dogs Go to Heaven (1989),"Place in the Sun, A (1951)",Mighty Aphrodite (1995),Maximum Overdrive (1986),Tales from the Darkside: The Movie (1990),It Takes Two (1995)
236,Bossa Nova (2000),Splendor in the Grass (1961),Chairman of the Board (1998),Demolition Man (1993),Re-Animator (1985),At Close Range (1986),Topkapi (1964),Love and Death on Long Island (1997),Click (2006),Bad Lieutenant (1992)
237,Teenage Mutant Ninja Turtles II: The Secret of the Ooze (1991),Something to Talk About (1995),Kiss of Death (1995),Road to Morocco (1942),Bloodsport 2 (a.k.a. Bloodsport II: The Next Kumite) (1996),Bicentennial Man (1999),"South Park: Bigger, Longer and Uncut (1999)",3 Ninjas: High Noon On Mega Mountain (1998),Quiz Show (1994),Letters from Iwo Jima (2006)
238,Van Helsing (2004),Ned Kelly (2003),Solo (1996),"Brain Smasher... A Love Story (Bouncer and the Lady, The) (1993)",Drag Me to Hell (2009),Barry Lyndon (1975),Pandorum (2009),Darby O'Gill and the Little People (1959),"Rookie, The (2002)",1969 (1988)
239,That Demon Within (2014),Carnival Magic (1981),Seventh Son (2014),"Lake House, The (2006)",Firefox (1982),"Maxed Out: Hard Times, Easy Credit and the Era of Predatory Lenders (2006)",Ladybird Ladybird (1994),Josie and the Pussycats (2001),Regret to Inform (1998),"Business of Strangers, The (2001)"
240,Drop Zone (1994),"Babysitter, The (1995)",Son in Law (1993),Barb Wire (1996),I'll Do Anything (1994),Blown Away (1994),"X-Files: Fight the Future, The (1998)",Mighty Morphin Power Rangers: The Movie (1995),Princess Caraboo (1994),In the Company of Men (1997)
241,"Watch, The (2012)",Dragon Ball Z: Resurrection of F (2015),April Morning (1988),Puppet Master II (1991),Otello (1986),RoboCop (1987),"Rookie, The (2002)",Orlando (1992),Blue Velvet (1986),Ben-Hur: A Tale of the Christ (1925)
242,Cemetery Man (Dellamorte Dellamore) (1994),Krippendorf's Tribe (1998),Night of the Comet (1984),"Sword in the Stone, The (1963)","Craft, The (1996)",Vanya on 42nd Street (1994),Romper Stomper (1992),Trouble in Paradise (1932),"I Love You, I Love You Not (1996)",In the Company of Men (1997)
243,Drop Zone (1994),Blood: The Last Vampire (2000),Quiz Show (1994),Under Siege 2: Dark Territory (1995),Mighty Aphrodite (1995),Barb Wire (1996),"Cry, the Beloved Country (1995)","Boys, The (1998)",I Shot Andy Warhol (1996),Jupiter's Wife (1994)
244,"American President, The (1995)",In the Company of Men (1997),Land Before Time III: The Time of the Great Giving (1995),Let's Get Harry (1986),Airheads (1994),Artemisia (1997),Dracula Untold (2014),Gloomy Sunday (Ein Lied von Liebe und Tod) (1999),Maximum Overdrive (1986),The Man in the Moon (1991)
245,Lawrence of Arabia (1962),Mr. Nice Guy (Yat goh ho yan) (1997),8 Heads in a Duffel Bag (1997),Rugrats in Paris: The Movie (2000),"Sword in the Stone, The (1963)","Saint, The (1997)",Artemisia (1997),Wet Hot American Summer (2001),Maze Runner: Scorch Trials (2015),Moulin Rouge (2001)
246,Hostage (2005),Cars (2006),"Kid in King Arthur's Court, A (1995)","Sword in the Stone, The (1963)",Burnt Offerings (1976),Bad Taste (1987),Crimes of the Heart (1986),Brüno (Bruno) (2009),Pay It Forward (2000),Red Beard (Akahige) (1965)
247,Beloved (1998),Wag the Dog (1997),Mighty Aphrodite (1995),Jupiter's Wife (1994),"Great White Hype, The (1996)",Five Deadly Venoms (1978),Romper Stomper (1992),Surrogates (2009),Chain Reaction (1996),"Boys, The (1998)"
248,"Aristocats, The (1970)",Babe (1995),Tarzan and the Lost City (1998),Safe (1995),"Lock, Stock & Two Smoking Barrels (1998)","Low Down Dirty Shame, A (1994)",Jupiter's Wife (1994),Lamerica (1994),"Seventh Sign, The (1988)",Mighty Aphrodite (1995)
249,"Synecdoche, New York (2008)",Creepshow (1982),"Red Balloon, The (Ballon rouge, Le) (1956)",Blue Chips (1994),Crimson Gold (Talaye sorgh) (2003),"Original Kings of Comedy, The (2000)",Bad Asses on the Bayou (2015),Grumpier Old Men (1995),Proof of Life (2000),Bloodsport 2 (a.k.a. Bloodsport II: The Next Kumite) (1996)
250,"Pink Panther 2, The (2009)","Sword in the Stone, The (1963)","Mrs. Brown (a.k.a. Her Majesty, Mrs. Brown) (1997)",Firestarter (1984),"Greatest Story Ever Told, The (1965)",Class Reunion (1982),"Scarlet Letter, The (1995)",Eye for an Eye (1996),Vampire in Venice (Nosferatu a Venezia) (Nosferatu in Venice) (1986),Wild Things (1998)
251,Mighty Aphrodite (1995),Quiz Show (1994),Letters from Iwo Jima (2006),Jupiter's Wife (1994),Dream for an Insomniac (1996),Witness (1985),Selena (1997),Toy Story 2 (1999),"Painted Veil, The (2006)",Underworld (1996)
252,Chaos (2005),Jungle2Jungle (a.k.a. Jungle 2 Jungle) (1997),Star Maps (1997),"Piano, The (1993)",Instinct (1999),"Wings of Desire (Himmel über Berlin, Der) (1987)",Big Fat Liar (2002),Creep (2014),"Whole Wide World, The (1996)",Edward Scissorhands (1990)
253,Dr. Horrible's Sing-Along Blog (2008),Howl's Moving Castle (Hauru no ugoku shiro) (2004),Clear and Present Danger (1994),Captains Courageous (1937),"Blood of the Beasts (Sang des bêtes, Le) (1949)","I Love You, I Love You Not (1996)","Innocent Man, An (1989)",Oklahoma! (1955),Men at Work (1990),Villain (1971)
254,Into the Forest of Fireflies' Light (2011),Autumn in New York (2000),13 Tzameti (2005),Letters from Iwo Jima (2006),Jungle2Jungle (a.k.a. Jungle 2 Jungle) (1997),Quiz Show (1994),Something to Talk About (1995),"Human Condition II, The (Ningen no joken II) (1959)",Bulworth (1998),Lady and the Tramp (1955)
255,Mumford (1999),Something to Talk About (1995),Trouble in Paradise (1932),Full Metal Jacket (1987),Almost Heroes (1998),City by the Sea (2002),Female Trouble (1975),Toy Story 2 (1999),Battle for the Planet of the Apes (1973),Teenage Mutant Ninja Turtles II: The Secret of the Ooze (1991)
256,Beloved (1998),"Glass House, The (2001)",Toy Story 2 (1999),Grumpier Old Men (1995),Turtle Diary (1985),Jumanji (1995),Letters from Iwo Jima (2006),Mighty Aphrodite (1995),"Princess Bride, The (1987)",Maximum Overdrive (1986)
257,Wet Hot American Summer (2001),Mighty Aphrodite (1995),Captains Courageous (1937),Quiz Show (1994),"I Love You, I Love You Not (1996)",All Dogs Go to Heaven (1989),Letters from Iwo Jima (2006),Jumanji (1995),Lost in America (1985),Scream 2 (1997)
258,Quiz Show (1994),"Lock, Stock & Two Smoking Barrels (1998)",Jumanji (1995),All Dogs Go to Heaven (1989),Clockwatchers (1997),Mighty Aphrodite (1995),Teenage Mutant Ninja Turtles II: The Secret of the Ooze (1991),Toy Story 2 (1999),Career Girls (1997),Villain (1971)
259,Dances with Wolves (1990),From Dusk Till Dawn (1996),"Punisher, The (1989)",Chain Reaction (1996),Titanic (1997),Triumph of the Will (Triumph des Willens) (1934),Robin Hood: Prince of Thieves (1991),"Little Rascals, The (1994)",Royal Flash (1975),What Love Is (2007)
260,Lake Placid (1999),"Namesake, The (2006)","Mothman Prophecies, The (2002)","Mummy, The (1932)",Bleeder (1999),Mixed Nuts (1994),Pickup on South Street (1953),Magic Mike XXL (2015),Thinner (1996),Seventh Son (2014)
261,Artemisia (1997),Road to Morocco (1942),Mighty Aphrodite (1995),"Mrs. Brown (a.k.a. Her Majesty, Mrs. Brown) (1997)","I Love You, I Love You Not (1996)",Under Siege 2: Dark Territory (1995),"Wings of Desire (Himmel über Berlin, Der) (1987)",Toy Story 2 (1999),Airheads (1994),Picture Perfect (1997)
262,Village of the Damned (1995),Vacation (2015),"Captain Newman, M.D. (1963)",Assassins (1995),Party Girl (1995),Something to Talk About (1995),Sense and Sensibility (1995),Pokémon the Movie 2000 (2000),Mighty Aphrodite (1995),Papillon (1973)
263,American Ninja (1985),Female Trouble (1975),"Aristocats, The (1970)",Jumanji (1995),Stage Fright (1950),Babe (1995),Mighty Aphrodite (1995),She's Having a Baby (1988),Night of the Comet (1984),Titanic (1997)
264,Lost in America (1985),Body Parts (1991),"Mrs. Brown (a.k.a. Her Majesty, Mrs. Brown) (1997)",Chain Reaction (1996),Beloved (1998),"Adventures of Priscilla, Queen of the Desert, The (1994)",Underneath (1995),Mighty Aphrodite (1995),"Aristocats, The (1970)",Babe (1995)
265,Jeremiah Johnson (1972),"Time Masters (Maîtres du temps, Les) (1982)",Any Given Sunday (1999),Ransom (1996),Whipped (2000),School Daze (1988),My Super Ex-Girlfriend (2006),Saturn 3 (1980),Saturn 3 (1980),Lilies of the Field (1963)
266,Hipsters (Stilyagi) (2008),The Falcon and the Snowman (1985),"Final Countdown, The (1980)","Scarlet Letter, The (1995)",Jeremiah Johnson (1972),Barry Lyndon (1975),Mickey Blue Eyes (1999),Even Cowgirls Get the Blues (1993),Two for the Money (2005),Fay Grim (2006)
267,Grave of the Fireflies (Hotaru no haka) (1988),Bound (1996),Bend It Like Beckham (2002),"South Park: Bigger, Longer and Uncut (1999)","Little Rascals, The (1994)",Mary Shelley's Frankenstein (Frankenstein) (1994),Joy Ride (2001),"Aristocats, The (1970)",Teenage Mutant Ninja Turtles II: The Secret of the Ooze (1991),Stop! Or My Mom Will Shoot (1992)
268,French Kiss (1995),Life with Mikey (1993),American Gigolo (1980),"Timecrimes (Cronocrímenes, Los) (2007)","Devil's Rejects, The (2005)",Don Juan DeMarco (1995),Possession (2002),Extreme Measures (1996),Brewster's Millions (1985),Futurama: Bender's Game (2008)
269,Chaos (2005),Beat the Devil (1953),Zero Effect (1998),"X-Files: Fight the Future, The (1998)",Robin Hood: Prince of Thieves (1991),Get on the Bus (1996),Muppet Treasure Island (1996),Three Colors: Red (Trois couleurs: Rouge) (1994),Jumanji (1995),Titanic (1997)
270,Legends of the Fall (1994),Garage Days (2002),15 Minutes (2001),First Knight (1995),F/X (1986),Little Big Man (1970),Muppet Treasure Island (1996),My Bloody Valentine 3-D (2009),Babe (1995),When the Levees Broke: A Requiem in Four Acts (2006)
271,Chitty Chitty Bang Bang (1968),American Psycho (2000),Boys Life (1995),Stripes (1981),Star Maps (1997),Quiz Show (1994),Oklahoma! (1955),Lost in America (1985),Yellow Submarine (1968),Frisk (1995)
272,Creep (2014),Clear and Present Danger (1994),Teenage Mutant Ninja Turtles II: The Secret of the Ooze (1991),Mighty Aphrodite (1995),Madame Bovary (1991),Dragon Ball Z Gaiden: The Plot to Destroy the Saiyans (1993),"Fast, Cheap & Out of Control (1997)","Lock, Stock & Two Smoking Barrels (1998)",Spy Game (2001),District 9 (2009)
273,Letters from Iwo Jima (2006),"Killer, The (Die xue shuang xiong) (1989)",Underneath (1995),"Legend of Sleepy Hollow, The (1980)",Higher Learning (1995),Sliding Doors (1998),"Aristocats, The (1970)",Being Human (1993),Something to Talk About (1995),Sabrina (1995)
274,Syrup (2013),Tokyo Tribe (2014),"Rundown, The (2003)","Duchess, The (2008)","Friend Is a Treasure, A (Chi Trova Un Amico, Trova un Tesoro) (Who Finds a Friend Finds a Treasure) (1981)",Mute Witness (1994),"Exorcism of Emily Rose, The (2005)",We Don't Live Here Anymore (2004),Lola Versus (2012),Guinevere (1999)
275,Nausicaä of the Valley of the Wind (Kaze no tani no Naushika) (1984),Allan Quatermain and the Lost City of Gold (1987),Some Like It Hot (1959),X2: X-Men United (2003),"Prince & Me, The (2004)",Accepted (2006),Stir of Echoes (1999),Boys and Girls (2000),Entrapment (1999),Trust (1990)
276,Calendar Girl (1993),"American President, The (1995)",Jumanji (1995),Color of Night (1994),Titanic (1997),Ladybird Ladybird (1994),"Aristocats, The (1970)",One True Thing (1998),Something to Talk About (1995),Heat (1995)
277,To Die For (1995),Coneheads (1993),Midnight Cowboy (1969),Moscow Does Not Believe in Tears (Moskva slezam ne verit) (1979),"Thin Line Between Love and Hate, A (1996)",New York Cop (Nyû Yôku no koppu) (1993),Legends of the Fall (1994),Leonard Part 6 (1987),"Joy Luck Club, The (1993)",Delicatessen (1991)
278,Cemetery Man (Dellamorte Dellamore) (1994),Amores Perros (Love's a Bitch) (2000),Sliding Doors (1998),Ghosts of Mars (2001),Hoodlum (1997),Yellow Submarine (1968),Kids in the Hall: Brain Candy (1996),Krippendorf's Tribe (1998),"Craft, The (1996)",Never Let Me Go (2010)
279,Mighty Aphrodite (1995),Road to Morocco (1942),"Gods Must Be Crazy, The (1980)",Clean Slate (1994),Toy Story 2 (1999),Buena Vista Social Club (1999),My Life (1993),Quiz Show (1994),Joe Gould's Secret (2000),'night Mother (1986)
280,"Saint, The (1997)",Idle Hands (1999),Porky's (1982),Under Suspicion (2000),Breaking the Waves (1996),Selena (1997),Clean Slate (1994),Beyond Borders (2003),Mighty Aphrodite (1995),'Salem's Lot (2004)
281,Paradise (1982),Babe (1995),"Man Without a Face, The (1993)",Tarzan (1999),Grave of the Fireflies (Hotaru no haka) (1988),Get Shorty (1995),Ali G Indahouse (2002),Jurassic Park III (2001),Trailer Park Boys (1999),Above the Law (1988)
282,Hellsinki (Rööperi) (2009),Return to Sender (2015),Burnt by the Sun (Utomlyonnye solntsem) (1994),Certified Copy (Copie conforme) (2010),Ink (2009),"Bounty, The (1984)",Foxfire (1996),"American Carol, An (2008)",Thumbelina (1994),Wet Hot American Summer (2001)
283,"Painted Veil, The (2006)",Something to Talk About (1995),"Cannonball Run, The (1981)",Dracula Untold (2014),Bait (2000),Mighty Aphrodite (1995),Female Trouble (1975),Kiss of Death (1995),Chocolat (1988),Star Maps (1997)
284,Lost in Translation (2003),Mixed Nuts (1994),"Natural, The (1984)",Undercurrent (1946),Nowhere in Africa (Nirgendwo in Afrika) (2001),Sphere (1998),Money Train (1995),Copycat (1995),Breaking the Waves (1996),Under Siege 2: Dark Territory (1995)
285,Thunderbirds (2004),I'm Starting From Three (Ricomincio da Tre) (1981),"Big Doll House, The (1971)",Bandidas (2006),Wild Things (1998),"Bucket Of Blood, A (1959)","People Under the Stairs, The (1991)",Atlantic City (1980),Goodfellas (1990),Phantoms (1998)
